{
  "id": "rrweb",
  "name": "rrweb session evidence recorder",
  "adapterVersion": "1.0.0",
  "sourceEntryId": "rrweb-io--rrweb",
  "status": "reviewed",
  "commandAllowlist": [
    [
      "npx",
      "rrweb",
      "record"
    ],
    [
      "node"
    ]
  ],
  "networkAllowlist": [],
  "limits": {
    "maxCpuMs": 300000,
    "maxMemoryMb": 2048,
    "maxWallClockS": 600,
    "maxOutputBytes": 10485760
  },
  "credentialMode": "none",
  "paidProvider": false,
  "fixtures": {
    "passing": "fixtures/passing.mjs",
    "plantedFailing": "fixtures/planted-failing.mjs",
    "unavailableDependency": "fixtures/unavailable.mjs"
  },
  "evidenceKinds": [
    "rrweb",
    "json_report"
  ]
}
