{
  "id": "cypress",
  "name": "Cypress (core web runner)",
  "adapterVersion": "1.0.0",
  "sourceEntryId": "mission.core.cypress",
  "status": "reviewed",
  "commandAllowlist": [
    [
      "npx",
      "cypress",
      "run"
    ],
    [
      "npx",
      "cypress",
      "open"
    ],
    [
      "node"
    ]
  ],
  "networkAllowlist": [],
  "limits": {
    "maxCpuMs": 300000,
    "maxMemoryMb": 2048,
    "maxWallClockS": 600,
    "maxOutputBytes": 10485760
  },
  "credentialMode": "none",
  "paidProvider": false,
  "fixtures": {
    "passing": "fixtures/passing.mjs",
    "plantedFailing": "fixtures/planted-failing.mjs",
    "unavailableDependency": "fixtures/unavailable.mjs"
  },
  "evidenceKinds": [
    "screenshot",
    "video",
    "log",
    "json_report"
  ]
}
