{
  "id": "datamimic",
  "name": "DATAMIMIC data generation",
  "adapterVersion": "1.0.0",
  "sourceEntryId": "rapiddweller--datamimic",
  "status": "reviewed",
  "commandAllowlist": [
    [
      "java",
      "-jar",
      "datamimic.jar"
    ],
    [
      "node"
    ]
  ],
  "networkAllowlist": [],
  "limits": {
    "maxCpuMs": 300000,
    "maxMemoryMb": 2048,
    "maxWallClockS": 600,
    "maxOutputBytes": 10485760
  },
  "credentialMode": "none",
  "paidProvider": false,
  "fixtures": {
    "passing": "fixtures/passing.mjs",
    "plantedFailing": "fixtures/planted-failing.mjs",
    "unavailableDependency": "fixtures/unavailable.mjs"
  },
  "evidenceKinds": [
    "json_report",
    "log"
  ]
}
