{
  "id": "bats-core",
  "name": "Bats shell test runner",
  "adapterVersion": "1.0.0",
  "sourceEntryId": "bats-core--bats-core",
  "status": "reviewed",
  "commandAllowlist": [
    [
      "bats",
      "test"
    ],
    [
      "bats",
      "--tap"
    ],
    [
      "node"
    ]
  ],
  "networkAllowlist": [],
  "limits": {
    "maxCpuMs": 300000,
    "maxMemoryMb": 2048,
    "maxWallClockS": 600,
    "maxOutputBytes": 10485760
  },
  "credentialMode": "none",
  "paidProvider": false,
  "fixtures": {
    "passing": "fixtures/passing.mjs",
    "plantedFailing": "fixtures/planted-failing.mjs",
    "unavailableDependency": "fixtures/unavailable.mjs"
  },
  "evidenceKinds": [
    "log",
    "json_report"
  ]
}
