{
  "id": "blns-boundary",
  "name": "Big List of Naughty Strings boundary fixtures",
  "adapterVersion": "1.0.0",
  "sourceEntryId": "minimaxir--big-list-of-naughty-strings",
  "status": "reviewed",
  "commandAllowlist": [
    [
      "python",
      "-m",
      "blns"
    ],
    [
      "node"
    ]
  ],
  "networkAllowlist": [],
  "limits": {
    "maxCpuMs": 300000,
    "maxMemoryMb": 2048,
    "maxWallClockS": 600,
    "maxOutputBytes": 10485760
  },
  "credentialMode": "none",
  "paidProvider": false,
  "fixtures": {
    "passing": "fixtures/passing.mjs",
    "plantedFailing": "fixtures/planted-failing.mjs",
    "unavailableDependency": "fixtures/unavailable.mjs"
  },
  "evidenceKinds": [
    "json_report"
  ]
}
