{
  "id": "foundry-hardhat",
  "name": "Foundry/Hardhat smart-contract tests",
  "adapterVersion": "1.0.0",
  "sourceEntryId": "foundry-rs--foundry",
  "status": "reviewed",
  "commandAllowlist": [
    [
      "forge",
      "test"
    ],
    [
      "npx",
      "hardhat",
      "test"
    ],
    [
      "node"
    ]
  ],
  "networkAllowlist": [
    "127.0.0.1"
  ],
  "limits": {
    "maxCpuMs": 300000,
    "maxMemoryMb": 2048,
    "maxWallClockS": 600,
    "maxOutputBytes": 10485760
  },
  "credentialMode": "none",
  "paidProvider": false,
  "fixtures": {
    "passing": "fixtures/passing.mjs",
    "plantedFailing": "fixtures/planted-failing.mjs",
    "unavailableDependency": "fixtures/unavailable.mjs"
  },
  "evidenceKinds": [
    "log",
    "json_report"
  ]
}
