{
  "id": "promptfoo",
  "name": "promptfoo AI contracts",
  "adapterVersion": "1.0.0",
  "sourceEntryId": "promptfoo--promptfoo",
  "status": "reviewed",
  "commandAllowlist": [
    [
      "npx",
      "promptfoo",
      "eval"
    ],
    [
      "node"
    ]
  ],
  "networkAllowlist": [
    "api.openai.com",
    "api.anthropic.com"
  ],
  "limits": {
    "maxCpuMs": 300000,
    "maxMemoryMb": 2048,
    "maxWallClockS": 600,
    "maxOutputBytes": 10485760
  },
  "credentialMode": "env_store",
  "paidProvider": false,
  "fixtures": {
    "passing": "fixtures/passing.mjs",
    "plantedFailing": "fixtures/planted-failing.mjs",
    "unavailableDependency": "fixtures/unavailable.mjs"
  },
  "evidenceKinds": [
    "model_transcript",
    "json_report"
  ]
}
