{
  "id": "vertaa11y",
  "name": "VertaaUX accessibility CLI",
  "adapterVersion": "1.0.0",
  "sourceEntryId": "vertaaux--cli",
  "status": "reviewed",
  "commandAllowlist": [
    [
      "npx",
      "@vertaaux/cli"
    ],
    [
      "node"
    ]
  ],
  "networkAllowlist": [],
  "limits": {
    "maxCpuMs": 300000,
    "maxMemoryMb": 2048,
    "maxWallClockS": 600,
    "maxOutputBytes": 10485760
  },
  "credentialMode": "none",
  "paidProvider": false,
  "fixtures": {
    "passing": "fixtures/passing.mjs",
    "plantedFailing": "fixtures/planted-failing.mjs",
    "unavailableDependency": "fixtures/unavailable.mjs"
  },
  "evidenceKinds": [
    "accessibility_tree",
    "json_report"
  ]
}
